ID,Work Item Type,Title,Test Step,Step Action,Step Expected,Area Path,Assigned To,State
84781.0,Test Case,71902-Template Field Search Page,,,,SG\Elections\Java,Sujatha Yelchuri <syelchuri@gocivix.com>,Ready
,,,1.0,Navigate to System Management->Notification->Template Fields,Template Field Search Page must be displayed,,,
,,,2.0,"Verify that the following search fields are displayed on the page
 
1.Name-Text field
2.Type-Drop down
3.Status-Drop down",The user should be able to perform a search and retrieve results using the search fields ,,,
,,,3.0,"In the Name field, enter the first few characters of the existing Template field 
 Name followed by ""%"" (e.g. id%) and hit ""Search""",Only the Names beginning with those first few characters entered mut be displayed in search results,,,
,,,4.0,"Click ""Reset""","Must clear all search fields and return to the default list
",,,
,,,5.0,"In the Name search field, enter ""%"" and then any few characters of the existing Name followed by another ""%"" and then the last few characters of the name field  (e.g. %CU%E)and hit ""Search""",Only the names that finish with those characters and contain those characters entered must be displayed in search results,,,
,,,6.0,"Click ""Reset""",Must clear all search fields and return to the default list,,,
,,,7.0,"In the Name search field, enter the first few characters of the existing Name followed by ""%"" and then any few characters that the name contains, followed by another ""%"" (e.g. T%PL%)	and hit ""Search""",Only the Names that begin with those characters and contain those characters entered must be displayed,,,
,,,8.0,"Click ""Reset""",Must clear all search fields and return to the default list,,,
,,,9.0,"From the Type  search criteria dropdown select a 'Type' and click ""Search""",Corresponding records must be displayed in search results,,,
,,,10.0,"From the Status search criteria dropdown select a 'status' and click ""Search"" ",Corresponding records must be displayed in search results,,,
,,,11.0,"Verify that the grid results display the following 
Actions(Edit, Delete)Name
Source
Type
Status
Value
ADD(Button)
","1.All columns must be sortable in both ascending and descending order.
2.Actions must have Edit and Delete options",,,
,,,12.0,Verify Paging functionality,Paging must be implemented.,,,
,,,13.0,"Click ""ADD""",Must navigate to Template field-Add Page,,,
,,,14.0,"Verify that the data entered on the Add page is displayed correctly on 
Template field-Search Page",Correct Data must be displayed,,,
85044.0,Test Case,71900-Add Notification Template,,,,SG\Elections\Java,Sujatha Yelchuri <syelchuri@gocivix.com>,Ready
,,,1.0,Navigate to System Management->Notification->Notification Template,Notification Template Field Search Page must be displayed,,,
,,,2.0,"Click on Add button
 

",Notification Template Add Page must be displayed ,,,
,,,3.0,"Verify below sections are displayed under Template tab
 1.Transaction Data
 2.Configuration Data
 3.Special Data
 4.Static Data
 5.Image","The respective sections should be displayed under the ""Template"" tab",,,
,,,4.0,"Verify below fields are displayed under Configuration tab
 ","
",,,
,,,5.0,Template ID,A read-only field to uniquely identify the template,,,
,,,6.0,Owner Dropdown,Drop down must display two values 'Client' and 'Base',,,
,,,7.0,Name,"The text box must allow alphanumeric characters, as well as the symbols &, /, \ , _ , and -",,,
,,,8.0,Type,Drop down must display two values 'Full' and 'Snippet',,,
,,,9.0,Status,"Drop down must display below values
""DRAFT""
""PUBLISHED""
""INACTIVE""",,,
,,,10.0,Notification Output Path-Text box,System must allow the user to specify a file path for storing output files Ex:/notification/PRT/samples,,,
,,,11.0,Notification Runner-Text Box,"System should accept valid class names in the correct format 
Ex: com.civixapps.shared.notification.handler.sample.SamplePrintNotificationHandler",,,
,,,12.0,Short Description-Text Box,"1.Text field allows the input of up to 80 characters
2.Text field must allow 80 alphanumeric and special characters (&, /, \, _, -) 
3.The text field does not accept any input beyond the 80-character limit",,,
,,,13.0,Detailed Description-Text Box,"1.Text field must allow the input of up to 500 characters
2.Text field must allow alphanumeric and special characters (&, /, \, _, -) 
3.The text field does not accept any input beyond the 500 character limit",,,
,,,14.0,Preview-Text Box,Must allow input,,,
,,,15.0,"Enter valid data in all mandatory fields and hit ""Save""","Must Save the template data successfully.Verify the saved template is displayed in Notification Template search screen.
",,,
,,,16.0,"Enter valid data in all mandatory fields and hit ""Cancel""",Must discard the changes and return to Template search screen.,,,
,,,17.0,Verify Drag and drop functionality for transaction data ,The correct placeholder template field must be dropped without distortion or errors.,,,
,,,18.0,Verify Drag and drop functionality for Configuration data ,The correct placeholder template field must be dropped without distortion or errors.,,,
,,,19.0,Verify Drag and drop functionality for special data ,The correct placeholder template field must be dropped without distortion or errors.,,,
,,,20.0,Verify Drag and drop functionality for static data ,The correct placeholder template field must be dropped without distortion or errors.,,,
,,,21.0,Verify Drag and drop functionality for Image,Image must be dropped without distortions,,,
88086.0,Test Case,SM-Notification Run Request Search-Verify Access Restriction for Non-County Users,,,,SG\Elections\Java\EMS,Sujatha Yelchuri <syelchuri@gocivix.com>,Ready
,,,1.0,Login as State User,"
",,,
,,,2.0,Navigate to SM->Notification->Notification Run Request Search,Notification Run Request Search page must be displayed,,,
,,,3.0,Verify Add button ,Add button should not be displayed ,,,
88087.0,Test Case,SM-Notification Run Request Search-Verify Access Restriction for County Users,,,,SG\Elections\Java\EMS,Sujatha Yelchuri <syelchuri@gocivix.com>,Ready
,,,1.0,Login as County User,"
",,,
,,,2.0,Navigate to SM->Notification->Notification Run Request Search,Notification Run Request Search page must be displayed,,,
,,,3.0,Verify Add button ,Add button must be displayed ,,,
,,,4.0,Click on search button and verify the grid results,The system must display only records corresponding to the logged-in county records from other counties should not be visible,,,
90017.0,Test Case,72783-Notice to Confirm Voter Registration Address,,,,SG\Elections\Java\EMS,Sujatha Yelchuri <syelchuri@gocivix.com>,Design
,,,1.0,Login as Region User,"
",,,
,,,2.0,"Navigate to System Management-> Notification->NotificationRequest
","Notification Run Request Search Page must be displayed
",,,
,,,3.0,Select a Linked Type 'Voter' and Notification Type 'Print',The corresponding results must be displayed on the search results grid,,,
,,,4.0,"Click ""ADD"" and enter all the mandatory fields and ""SAVE""
Notification Template-Notice to Confirm Voter Registration Address
Linked Object Type-Voter
Linked Object Id-Voter Id
Notification Criteria-{""v_voter.id_voter"":"" enter voter id number ""}
Ex: {""v_voter.id_voter"":""333""}","1.User Navigates back to Notification Run Request Search Page
2.Added notification request is displayed in grid results with appropriate status 'Completed'
Note: The status starts as Pending, then transitions to In Progress, and finally to Completed ",,,
,,,5.0,"Click on the ""Actions"" ellipsis ",Options are displayed,,,
,,,6.0,"Click on ""Download""",PDF File is downloaded successfully and status is 'Viewed',,,
,,,7.0,"Check the Report to ensure that the data displayed matches the Voter details-voter’s address, name and region are displayed correctly",The data in the PDF report must align with the  voter registration data,,,
,,,8.0,Ensure the voter registrar's address and phone number on the office data page are correctly displayed in the PDF,The data in the PDF report must match,,,
90811.0,Test Case,88005-SM- Function – Notifications-Review Notification Before Generation - Update Button Behavior-Applying/Retaing Selected Notice of Action,,,,SG\Elections\Java\EMS\VM\Voter,Jorge Taveras <jtaveras@gocivix.com>,Design
,,,1.0,"Preconditions:  Logged as State User, Notifications Added before, Notification review- before generation option selected","
",,,
,,,2.0,Select a notification and click on take action,The system displays the preview action,,,
,,,3.0,Click on the preview option ,The system displays the notification preview,,,
,,,4.0,Click and select the new Notice Of Action,The system displays the Noctice Of Action selected,,,
,,,5.0,Click on the update button.,The system displays the selected Notice of Action applied to the notification.                                                               The system displays the changes on the preview.                                                                                                  The system retains the selected Notice of Action until a new one is selected.,,,
90815.0,Test Case,88005-SM- Function – Notifications-Review Notification Before Generation - Update Button Behavior-Applying/Retaing Selected Notice Sent Date,,,,SG\Elections\Java\EMS\VM\Voter,Jorge Taveras <jtaveras@gocivix.com>,Design
,,,1.0,"Preconditions:  Logged as State User, Notifications Added before, Notification review- before generation option selected","
",,,
,,,2.0,Select a notification and click on take action,The system displays the preview action,,,
,,,3.0,Click on the preview option ,The system displays the notification preview,,,
,,,4.0,Click and Select a Notice Sent Date from the available date options.,The system displays the calendar with the Sent Date available,,,
,,,5.0,Click on the update button.,The system displays the selected Sent Date applied to the notification.                                                               The system displays the changes on the preview.                                                                                                  The system retains the selected Notice Sent Date until a new one is selected.                                           The system displays a pop-up with the result of the transaction.,,,
90816.0,Test Case,88005-SM- Function – Notifications-Review Notification Before Generation - Update Button Behavior-Applying/Retaing Selected Notice Sent Date & Notice of Action,,,,SG\Elections\Java\EMS\VM\Voter,Jorge Taveras <jtaveras@gocivix.com>,Design
,,,1.0,"Preconditions:  Logged as State User, Notifications Added before, Notification review- before generation option selected","
",,,
,,,2.0,Select a notification and click on take action,The system displays the preview action,,,
,,,3.0,Click on the preview option ,The system displays the notification preview,,,
,,,4.0,Click and Select a Notice Sent Date and a Notice of Action from the available options.,The system displays the calendar with the Sent Date available and the Notice of Action selected,,,
,,,5.0,Click on the update button.,The system displays the selected Sent Date and Notice of Action applied to the notification.                                                               The system displays the changes on the preview.                                                                                                  The system retains the selected Notice Sent Date and the Notice of Action until a new one is selected.                                                                 The system displays a pop-up with the result of the transaction.,,,
90926.0,Test Case,88005-SM- Function – Notifications-Review Notification Before Generation - Update Button Behavior-Applying/Retaing Selected Notice of Action - Review Screen,,,,SG\Elections\Java\EMS\VM\Voter,Jorge Taveras <jtaveras@gocivix.com>,Design
,,,1.0,"Preconditions:  Logged as State User, Notifications Added before, Notification review- before generation option selected","
",,,
,,,2.0,Select a notification and click on take action,The system displays the preview action,,,
,,,3.0,Click and select the new Notice Of Action,The system displays the Noctice Of Action selected,,,
,,,4.0,Click on Apply Default Selected Button,The system applied the changes in all the notifications,,,
,,,5.0,Click on Preview option ,The system displays the preview notification,,,
,,,6.0,Click on the update button.,The system displays the selected Notice of Action applied to the notification.                                                               The system displays the changes on the preview.                                                                                                  The system retains the selected Notice of Action until a new one is selected.,,,
90935.0,Test Case,88005-SM- Function – Notifications-Review Notification Before Generation - Update Button Behavior-Applying/Retaing Selected Notice Sent Date - Review Screen,,,,SG\Elections\Java\EMS\VM\Voter,Jorge Taveras <jtaveras@gocivix.com>,Design
,,,1.0,"Preconditions:  Logged as State User, Notifications Added before, Notification review- before generation option selected","
",,,
,,,2.0,Select a notification and click on take action,The system displays the preview action,,,
,,,3.0,Click and Select a Notice Sent Date from the available date options.,The system displays the calendar with the Sent Date available,,,
,,,4.0,Click on Apply Default Selected Button,The system applied the changes in all the notifications,,,
,,,5.0,Click on the preview option ,The system displays the notification preview,,,
,,,6.0,Click on the update button.,The system displays the selected Sent Date applied to the notification.                                                               The system displays the changes on the preview.                                                                                                  The system retains the selected Notice Sent Date until a new one is selected.                                           The system displays a pop-up with the result of the transaction.,,,
90936.0,Test Case,88005-SM- Function – Notifications-Review Notification Before Generation - Update Button Behavior-Applying/Retaing Selected Notice Sent Date & Notice of Action - Review Screen,,,,SG\Elections\Java\EMS\VM\Voter,Jorge Taveras <jtaveras@gocivix.com>,Design
,,,1.0,"Preconditions:  Logged as State User, Notifications Added before, Notification review- before generation option selected","
",,,
,,,2.0,Select a notification and click on take action,The system displays the preview action,,,
,,,3.0,Click and Select a Notice Sent Date and a Notice of Action from the available options.,The system displays the calendar with the Sent Date available and the Notice of Action selected,,,
,,,4.0,Click on Apply Default Selected Button,The system applied the changes in all the notifications,,,
,,,5.0,Click on the preview option ,The system displays the notification preview,,,
,,,6.0,Click on the update button.,The system displays the selected Sent Date and Notice of Action applied to the notification.                                                               The system displays the changes on the preview.                                                                                                  The system retains the selected Notice Sent Date and the Notice of Action until a new one is selected.                                                                 The system displays a pop-up with the result of the transaction.,,,
91486.0,Test Case,88007 - SM  - Notification Review Before Generation Button,,,,SG\Elections\Java\EMS\VM\Voter,Yahaira Barrios <ybarrios@gocivix.com>,Ready
,,,1.0,"Preconditions 
Logged as County User","
",,,
,,,2.0,Navigate to System Management Module,"
",,,
,,,3.0,Select Notifications,Note Review Notification Before Generation Button is present,,,
,,,4.0,Click on Review Notification Before Generation Button,Notification Review - Before Generation page is displayed,,,
,,,5.0,Look Filters Section,"Upload Date, Document Type, Linked Object Type, Linked Object Linked, First Name, Last Name fields are present",,,
,,,6.0,Look Under the Filters Section,"Buckets for each type of Document Type are listed, with the count of documents for each of those",,,
,,,7.0,Look Search and Reset Buttons are present,"
",,,
,,,8.0,Observe the grid,"Select checkbox, Id, Uploaded Date, Created User, Document Type, Linked Object Type, Linked Object ID, Last Name first Name are present",,,
,,,9.0,Look Take Action Button is under the grid,"
",,,
,,,10.0,Click on Linked Object Type Dropdown,"List of Items Candidate, Poll Place, Poll Worker, Voter is displayed",,,
,,,11.0,Select Voters,"
",,,
,,,12.0,Press Search Button,Grid is populated,,,
,,,13.0,Click on checkbox for the item Selected,"
",,,
,,,14.0,Press Take Action button,Notification Review Action page is displayed with the information of the selected item,,,
91518.0,Test Case,88007 - SM - Notification Review Before Generation - Search Functionality,,,,SG\Elections\Java\EMS\VM\Voter,Yahaira Barrios <ybarrios@gocivix.com>,Ready
,,,1.0,"Preconditions
Logged as County
Dummy Data for Voters already Loaded in the system","
",,,
,,,2.0,Navigate to System Management Module,"
",,,
,,,3.0,Click on Notifications,"
",,,
,,,4.0,Click on Notification Review Button,Notification Review - Before Generation page is opened,,,
,,,5.0,Click on Search Button without select any filter,Alert Message is displayed to inform the user the Linked Object Type is mandatory,,,
,,,6.0,On Linked Object Type dropdown select Voter,"
",,,
,,,7.0,Press Search Button,All data for Voters loaded before is displayed on the grid,,,
,,,8.0,Press Reset Button,Grid and Linked Object Type dropdown are cleared out,,,
,,,9.0,Fill Date field and Linked Object Type Dropdown ,"
",,,
,,,10.0,Press Search Button,Grid display the data for the voter that meets the search criteria,,,
,,,11.0,Press Reset button,Filter fields and grid are cleared out,,,
,,,12.0,Select Document Type and Linked Object Type,"
",,,
,,,13.0,Press Search Button,Grid display the data that meets the search criteria,,,
,,,14.0,Press Reset Button,Filter fields and grid are cleared out,,,
,,,15.0,Select Linked Object Type and fill the corresponding Linked Object ID,"
",,,
,,,16.0,Press Search Button,Grid display the data that meets the search criteria,,,
,,,17.0,Press Reset Button,Filter fields and grid are cleared out,,,
,,,18.0,Select Linked Object Type and Fill Last Name,"
",,,
,,,19.0,Press Search Button,Grid display the data that meets the search criteria,,,
,,,20.0,Press Reset Button,Filter fields and grid are cleared out,,,
,,,21.0,Select Linked Object Type and Fill First Name,"
",,,
,,,22.0,Press Search Button,Grid display the data that meets the search criteria,,,
,,,23.0,Press Reset Button,Filter fields and grid are cleared out,,,
91565.0,Test Case,88007 - SM - Notification Review Before Generation - Buckets Functionality,,,,SG\Elections\Java\EMS\VM\Voter,Yahaira Barrios <ybarrios@gocivix.com>,Ready
,,,1.0,Preconditions Logged as County User,"
",,,
,,,2.0,Navigate to System Management Module,"
",,,
,,,3.0,Select Notifications,Note Review Notification Before Generation Button is present,,,
,,,4.0,Click on Review Notification Before Generation Button,Notification Review - Before Generation page is displayed,,,
,,,5.0,Look Under the Filters Section,"Buckets for each type of Document Type are listed, with the count of documents for each of those",,,
,,,6.0,Click on CROSS-STATE Voters Bucket,The quantity displayed on the bucket is the same quantity of items displayed on the grid,,,
,,,7.0,Press Reset Button,"
",,,
,,,8.0,Click on Type Document Drop Down select Cross State,"
",,,
,,,9.0,Click on Linked Object Type select Voters,"
",,,
,,,10.0,Press Search Button,The items displayed in the grid after the search are the same items displayed on the grid when click on the Cross - State Voters Bucket,,,
,,,11.0,Click on IDLE Voters Bucket,The quantity displayed on the bucket is the same quantity of items displayed on the grid,,,
,,,12.0,Press Reset Button,"
",,,
,,,13.0,Click on Type Document Drop Down select IDLE,"
",,,
,,,14.0,Click on Linked Object Type select Voters,"
",,,
,,,15.0,Press Search Button,The items displayed in the grid after the search are the same items displayed on the grid when click on the IDLE Voters Bucket,,,
,,,16.0,Click on IN-STATE Voters Bucket,The quantity displayed on the bucket is the same quantity of items displayed on the grid,,,
,,,17.0,Press Reset Button,"
",,,
,,,18.0,Click on Type Document Drop Down select IN STATE,"
",,,
,,,19.0,Click on Linked Object Type select Voters,"
",,,
,,,20.0,Press Search Button,The items displayed in the grid after the search are the same items displayed on the grid when click on the IN-STATE Voters Bucket,,,
,,,21.0,Click on NCOA Voters Bucket,The quantity displayed on the bucket is the same quantity of items displayed on the grid,,,
,,,22.0,Press Reset Button,"
",,,
,,,23.0,Click on Type Document Drop Down select NCOA,"
",,,
,,,24.0,Click on Linked Object Type select Voters,"
",,,
,,,25.0,Press Search Button,The items displayed in the grid after the search are the same items displayed on the grid when click on the NCOA Voters Bucket,,,
,,,26.0,Add a IN STATE document ,IN-STATE Bucket counter is increased,,,
,,,27.0,Add a NCOA document,NCOA Bucket counter is increased,,,
,,,28.0,Add a CROSS STATE document,CROSS-STATE counter is increased,,,
,,,29.0,Add a IDLE document,IDLE counter is increased,,,
,,,30.0,Click on each bucket,Quantity of items displayed on grid are equal to the Bucket counter selected,,,
,,,31.0,Remove a NCOA Document,Confirm Bucket Counter is decreased,,,
,,,32.0,Click on the NCOA Bucket,Confirm Items displayed,,,
,,,33.0,,,,,
91690.0,Test Case,Add/Maintain Notification Cancellation Request,,,,SG\Elections\Java\EMS,Sujatha Yelchuri <syelchuri@gocivix.com>,Design
,,,1.0,Navigate to System Management-> Notification->Notification Request,Notification Run Request Search Page must be displayed,,,
,,,2.0,Select a Linked Type 'Voter' and Notification Type 'Print',The corresponding results must be displayed on the search results grid,,,
,,,3.0,"Click ADD and enter all the mandatory fields and SAVE
Notification Template-Cancellation Letter
Linked Object Type-Voter
Linked Object Id-Voter Id
Notification Criteria-{""v_voter.id_voter"":"" enter voter id number ""}
Ex: {""v_voter.id_voter"":""333""}
 

","1.User Navigates back to Notification Run Request Search Page
2.Added notification request is displayed in grid results with appropriate status 'Completed'",,,
,,,4.0,"Click on the ""Actions"" ellipsis ","A dropdown with View, Download, and Delete options appears.",,,
,,,5.0,Click View from the ellipsis menu,"
",,,
,,,6.0,Click  Download from the ellipsis menu,PDF File is downloaded successfully and status is 'Viewed',,,
,,,7.0,Click Delete from the ellipsis menu,A confirmation prompt appears ,,,
,,,8.0,Click on OK,"The system displays a ""successfully Deleted "" message, and the request is no longer visible in the list.",,,
,,,9.0,"
","
",,,
91691.0,Test Case,Notice to Confirm Voter Registration Address,,,,SG\Elections\Java\EMS,Sujatha Yelchuri <syelchuri@gocivix.com>,Ready
,,,1.0,Login as Region User,"
",,,
,,,2.0,"Navigate to System Management-> Notification->NotificationRequest
","Notification Run Request Search Page must be displayed
",,,
,,,3.0,Select a Linked Type 'Voter' and Notification Type 'Print',The corresponding results must be displayed on the search results grid,,,
,,,4.0,"Click ""ADD"" and enter all the mandatory fields and ""SAVE""
Notification Template-Notice to Confirm Voter Registration Address
Linked Object Type-Voter
Linked Object Id-Voter Id
Notification Criteria-{""v_voter.id_voter"":"" enter voter id number ""}
Ex: {""v_voter.id_voter"":""333""}","1.User Navigates back to Notification Run Request Search Page
2.Added notification request is displayed in grid results with appropriate status 'Completed'
Note: The status starts as Pending, then transitions to In Progress, and finally to Completed ",,,
,,,5.0,"Click on the ""Actions"" ellipsis ",Options are displayed,,,
,,,6.0,"Click on ""Download""",PDF File is downloaded successfully and status is 'Viewed',,,
,,,7.0,"Check the Report to ensure that the data displayed matches the Voter details-voter’s address, name and region are displayed correctly",The data in the PDF report must align with the  voter registration data in EMS,,,
,,,8.0,Ensure the voter registrar's address and phone number on the office data page are correctly displayed in the PDF,The data in the PDF report must match,,,
,,,9.0,Verify the content of the PDF notification ,"Must match with the content provided in the sample report
Note: Attached Sample file for reference",,,
91692.0,Test Case,Notice of Defective Application for Ballot by Mail,,,,SG\Elections\Java\EMS,Sujatha Yelchuri <syelchuri@gocivix.com>,Ready
,,,1.0,Login as Region User,"
",,,
,,,2.0,"Navigate to System Management-> Notification->NotificationRequest
","Notification Run Request Search Page must be displayed
",,,
,,,3.0,"Click ""ADD"" and enter all the mandatory fields and ""SAVE""
Notification Template-Notice of Defective Application for Ballot by Mail
Linked Object Type-Voter
Linked Object Id-Voter Id
Notification Criteria-{""v_voter.id_voter"":"" enter voter id number ""}
Ex: {""v_voter.id_voter"":""333""}","1.User Navigates back to Notification Run Request Search Page
2.Added notification request is displayed in grid results with appropriate status 'Completed'
Note: The status starts as Pending, then transitions to In Progress, and finally to Completed ",,,
,,,4.0,"Click on the ""Actions"" ellipsis ",Options are displayed,,,
,,,5.0,"Click on ""Download""",PDF File is downloaded successfully and status is 'Viewed',,,
